{
  "schema_version": "atlas.assurance-controls.v1",
  "canonical_repository": "Jktomy/atlas-prime",
  "register_role": "CONTROLLING_ASSURANCE_RULES_ONLY",
  "applicability_outcomes": [
    "APPLIED",
    "NOT_APPLICABLE"
  ],
  "unknown_applicability": "FAIL_CLOSED",
  "controls": [
    {
      "control_id": "ASC-001",
      "title": "Sunset exact Feather, Sunset, and Sunrise cardinality",
      "status": "ACTIVE",
      "objective": "Every completed full Atlas Sunset creates exactly one new sealed Feather, exactly one immutable Sunset bound to it, and exactly one Sunrise bound to the same pair.",
      "applies_when": "The semantic objective is a full Atlas Sunset or a closeout that claims Sunset completion.",
      "required_evidence": [
        "Exact candidate inventory proves one Feather, one Sunset, and one Sunrise.",
        "Schema and relationship validation prove the same Feather/Sunset pair across all three records."
      ],
      "enforcement_sources": [
        "governance/lesson-harvest-protocol.md",
        "lifecycle/lifecycle-contract.md",
        "tests/prime-program/test_lesson_harvest_protocol.py"
      ],
      "superseded_by": null
    },
    {
      "control_id": "ASC-002",
      "title": "Lessons never self-promote",
      "status": "ACTIVE",
      "objective": "Observations and Golden Wing candidates gain no authority until human-controlled review absorbs the lesson into a real enforced control.",
      "applies_when": "A Preview, Build, review, Sunset, or continuity action identifies, evaluates, records, or reuses a lesson.",
      "required_evidence": [
        "The lesson remains observation evidence or a Golden Wing candidate before reviewed absorption.",
        "Any claimed absorption names an ACTIVE assurance control and its enforcing source and test."
      ],
      "enforcement_sources": [
        "governance/lesson-harvest-protocol.md",
        "governance/atlas-aegis.md",
        "governance/atlas-strikeforce.md",
        "tests/prime-program/test_assurance_controls.py"
      ],
      "superseded_by": null
    },
    {
      "control_id": "ASC-003",
      "title": "Repository process preserves one transaction, Aegis Break primary routing, and isolated recovery",
      "status": "ACTIVE",
      "objective": "Prime repository work uses one exact transaction identity and one complete sealed candidate, selects Aegis Break as Athena's primary current-GitHub method over an atomic Git-data substrate, and preserves Sword/Oathbringer as an independently executable recovery publisher.",
      "applies_when": "The objective creates, repairs, reviews, readies, merges, reverts, or recovers a Prime repository candidate or changes repository-process doctrine, routing, or tooling.",
      "required_evidence": [
        "The exact candidate binds transaction, base, route, substrate, paths, bytes, tree, validation, review, permanence mode, and rollback identity.",
        "Any route takeover reconciles the existing branch, PR, head, and receipts before mutation and does not create duplicate work.",
        "Aegis Break remains a bounded method rather than a standing publisher; current GitHub construction is atomic and Oathbringer recovery remains failure-isolated.",
        "Historical Spear and Thread Engine proof remains truthful while retired GitHub Direct Spear dispatch is not selected as the current default."
      ],
      "enforcement_sources": [
        "governance/aegis-break-primary-route-contract.md",
        "governance/repository-process-contract.md",
        "governance/change-routes.md",
        "recovery/elantris-recovery.md",
        "tests/prime-program/test_aegis_break_primary_route.py",
        "tests/prime-program/test_prime_human_merge_route.py"
      ],
      "superseded_by": null
    },
    {
      "control_id": "ASC-004",
      "title": "Shardblade is one-use exact-head compare-and-swap permanence",
      "status": "ACTIVE",
      "objective": "Machine permanence occurs only from a current explicit Jayson Shardblade instruction for one unchanged exact candidate after required status, resolved review, Strikeforce GREEN, replay reservation, rollback proof, atomic expected-head binding, and canonical readback.",
      "applies_when": "A Prime repository transaction proposes, authorizes, performs, reports, recovers, or changes Shardblade or any automated merge behavior.",
      "required_evidence": [
        "The current instruction unambiguously grants transaction-scoped Shardblade authority and no standing approval is inferred.",
        "The merge request binds the expected head SHA and rejects any head, tree, path, status, review, authority, or replay drift.",
        "The receipt and canonical-main readback prove the exact result; ambiguous results use readback-only reconciliation and never blind retry."
      ],
      "enforcement_sources": [
        "governance/repository-process-contract.md",
        "governance/shard-doctrine.md",
        "safety/atlas-safety-doctrine.md",
        "governance/atlas-strikeforce.md",
        "tests/prime-program/test_prime_human_merge_route.py"
      ],
      "superseded_by": null
    },
    {
      "control_id": "ASC-005",
      "title": "Every full Sunset requires exact Preview approval",
      "status": "ACTIVE",
      "objective": "No full Atlas Sunset candidate may be constructed, published, or declared complete without one user-visible Preview and explicit Jayson approval bound to the same semantic payload.",
      "applies_when": "The semantic objective is a full Atlas Sunset, a Sunset repair, or any action that constructs, publishes, resumes, or claims completion of Sunset lifecycle records.",
      "required_evidence": [
        "The exact Preview ID, Preview digest, semantic digest, scope, record plan, and permitted approval modes are present.",
        "The explicit Jayson approval and generated request bind the unchanged Preview, semantic payload, and selected permanence mode.",
        "Any changed scope, lesson harvest, source lock, route, or record plan invalidates approval before candidate output."
      ],
      "enforcement_sources": [
        "lifecycle/lifecycle-contract.md",
        "governance/lesson-harvest-protocol.md",
        "tools/atlas_lifecycle/sunset_preview.py",
        "tests/lifecycle/test_sunset_preview.py"
      ],
      "superseded_by": null
    },
    {
      "control_id": "ASC-006",
      "title": "Sunset save state survives route failure",
      "status": "ACTIVE",
      "objective": "A connector, executor, network, repository, or local-checkout failure may delay canonical Sunset publication but may not destroy, replace, duplicate, or falsely complete the approved save point.",
      "applies_when": "A full Sunset is approved, blocked, resumed, rerouted, published, or recovered before canonical readback completes.",
      "required_evidence": [
        "One route-neutral approved carrier binds the exact Preview, approval, semantic payload, record plan, selected route, and fallback routes.",
        "A blocked route preserves the same carrier and transaction identity and creates no duplicate branch, PR, or Sunset.",
        "Only canonical merged-main readback permits the terminal SUNSET COMPLETE claim."
      ],
      "enforcement_sources": [
        "lifecycle/lifecycle-contract.md",
        "governance/repository-process-contract.md",
        "recovery/elantris-recovery.md",
        "tools/atlas_lifecycle/sunset_preview.py",
        "tests/lifecycle/test_sunset_preview.py"
      ],
      "superseded_by": null
    },
    {
      "control_id": "ASC-007",
      "title": "Sunset lessons receive explicit disposition and follow-up",
      "status": "ACTIVE",
      "objective": "Every full Atlas Sunset performs Lesson Harvest, gives each observation one explicit disposition, and truthfully records whether it remains local, reinforces an existing safeguard, requires Golden Wing candidacy, requires assurance absorption, or is rejected.",
      "applies_when": "A Sunset Preview, candidate, review, closeout, Sunrise, Golden Wing, or assurance-control action evaluates or reuses a lesson.",
      "required_evidence": [
        "Every observation has one permitted disposition and an evidence-backed rationale, or the Harvest has one exact no-lesson reason.",
        "Existing Golden Wing references resolve and are carried into Sunrise; candidate and absorption dispositions remain explicit follow-up obligations.",
        "No observation, Feather, Golden Wing candidate, CI result, or Strikeforce verdict self-promotes into doctrine or authority."
      ],
      "enforcement_sources": [
        "governance/lesson-harvest-protocol.md",
        "lifecycle/lifecycle-contract.md",
        "tools/atlas_lifecycle/sunset_preview.py",
        "tests/lifecycle/test_sunset_preview.py",
        "tests/prime-program/test_assurance_controls.py"
      ],
      "superseded_by": null
    }
  ]
}
